{
  "game_id": "test-game-01",
  "room_code": "TEST01",
  "game_mode": "CLASSIC",
  "winner": "VILLAGERS",
  "exported_at": "2026-06-01T10:00:00.000Z",
  "events": [
    {"type": "chat", "round": 1, "phase": "NIGHT", "player_name": "System", "player_role": "", "target_name": "", "content": "Night 1 begins.", "is_system": true, "timestamp": "2026-06-01T09:00:00.000Z"},
    {"type": "night_action", "round": 1, "phase": "NIGHT", "player_name": "Alpha", "player_role": "WEREWOLF", "target_name": "Delta", "content": "KILL", "is_system": false, "timestamp": "2026-06-01T09:01:00.000Z"},
    {"type": "chat", "round": 1, "phase": "DAY", "player_name": "System", "player_role": "", "target_name": "", "content": "Dawn breaks. Delta (villager) was found dead.", "is_system": true, "timestamp": "2026-06-01T09:02:00.000Z"},
    {"type": "chat", "round": 1, "phase": "DAY", "player_name": "Bravo", "player_role": "VILLAGER", "target_name": "", "content": "That is terrible!", "is_system": false, "timestamp": "2026-06-01T09:03:00.000Z"},
    {"type": "chat", "round": 1, "phase": "DAY", "player_name": "Carol", "player_role": "SEER", "target_name": "", "content": "I have suspicions.", "is_system": false, "timestamp": "2026-06-01T09:04:00.000Z"},
    {"type": "chat", "round": 1, "phase": "DAY", "player_name": "System", "player_role": "", "target_name": "", "content": "Voting begins.", "is_system": true, "timestamp": "2026-06-01T09:05:00.000Z"},
    {"type": "day_vote", "round": 1, "phase": "DAY", "player_name": "Bravo", "player_role": "VILLAGER", "target_name": "Alpha", "content": "EXILE", "is_system": false, "timestamp": "2026-06-01T09:06:00.000Z"},
    {"type": "chat", "round": 1, "phase": "DAY", "player_name": "System", "player_role": "", "target_name": "", "content": "The village voted to skip. No one was eliminated.", "is_system": true, "timestamp": "2026-06-01T09:07:00.000Z"},
    {"type": "chat", "round": 2, "phase": "NIGHT", "player_name": "System", "player_role": "", "target_name": "", "content": "Night 2 begins.", "is_system": true, "timestamp": "2026-06-01T09:08:00.000Z"},
    {"type": "night_action", "round": 2, "phase": "NIGHT", "player_name": "Alpha", "player_role": "WEREWOLF", "target_name": "Bravo", "content": "KILL", "is_system": false, "timestamp": "2026-06-01T09:09:00.000Z"},
    {"type": "chat", "round": 2, "phase": "DAY", "player_name": "System", "player_role": "", "target_name": "", "content": "Dawn breaks. Bravo (villager) was found dead.", "is_system": true, "timestamp": "2026-06-01T09:10:00.000Z"},
    {"type": "chat", "round": 2, "phase": "DAY", "player_name": "System", "player_role": "", "target_name": "", "content": "Voting begins.", "is_system": true, "timestamp": "2026-06-01T09:11:00.000Z"},
    {"type": "day_vote", "round": 2, "phase": "DAY", "player_name": "Carol", "player_role": "SEER", "target_name": "Alpha", "content": "EXILE", "is_system": false, "timestamp": "2026-06-01T09:12:00.000Z"},
    {"type": "chat", "round": 2, "phase": "DAY", "player_name": "System", "player_role": "", "target_name": "", "content": "The village voted. Alpha (werewolf) has been eliminated.", "is_system": true, "timestamp": "2026-06-01T09:13:00.000Z"},
    {"type": "chat", "round": 2, "phase": "DAY", "player_name": "System", "player_role": "", "target_name": "", "content": "Dawn breaks. Nobody died.", "is_system": true, "timestamp": "2026-06-01T09:14:00.000Z"}
  ]
}
